Text,Value
i still sort of agree with that description but i ve come to think that the great thing about this song and about all concise guitar pop songs that so accurately hit home the singular feeling of romantic possibility is the way that it lets you write your own starring scene,2
i have a lovely nesty feeling after looking at all that cute teeny weeny clothing,1
i shouldnt be afraid to go out in public and feel paranoid because ive done nothing wrong,4
i volunteered for everything and wound up feeling overwhelmed and people got mad at me for not being able to meet my obligations,5
i am feeling melancholy i ll embrace it and listen to some slow downtempo melancholic pop,0
i saw i had a direct message dm on twitter from a former friend jeff who i no longer feel friendly toward,1
i feel xs more indecisive,4
i sat down at the computer feeling nervous excited and more than a little silly,4
i have kept quiet when someone did or said something hurtful and not said what i was feeling because i did not want to be rude,3
i came to this realization that i was often feeling blamed or being blamed for things that were utterly outside of my control,0
i have been feeling so bad that he has to be coherent and deal with teenagers all week,0
i was feeling very unsure as to whether or not i should continue to blog at all,4
i will never forget that walk out of the doctor s office that afternoon feeling so determined not take for granted my health again,1
i continue to feel inspired by the strong runner she has become this year,1
i hate the feeling of being disliked and it seems as though its very common for me,0
i feel miserable after my break up self,0
i feel like i m a very very dangerous human being right now,3
i feel very strongly that the only way to eat cornbread is if its sweet cornbread with butter and honey dripping off each piece,2
i really had prepared ourselves for the worst but we both had the innate feeling that everything was fine,1
i feel paranoid when i wear makeup out,4
i feel generous sometimes and feed a little of those savings to the birds,2
i love the combination of lavender and orange scent but feel free to substitute any other fragrance oil or essential oils that you wish,1
i feel like we just rushed around trying to see things its still quite beautiful,3
i search search search and very rarely feel satisfied with the solutions found,1
i feel petty moaning about it but its annoying me so from now on im keeping my stuff in a bag in my room if they ask i can always say im keeping it there to stop the bathroom getting cluttered,3
im feeling that joy every day with some of the most gorgeous people ive ever met and hope this thanksgiving you felt the same,1
i can t be with her in portland and i feel fairly useless here in strasbourg,0
i got a feeling that the hateful talk in the work place wore thin and they kept her around only for what they absolutely needed her to cover,3
i also feel paranoid that everyone is listening to my phone conversations whats that all about,4
i feel it s a worthwhile cause and hope you decide to participate,1
i feel disturbed and sad,0
i feel like i can and have accepted that but will others,2
i feel very slutty,2
i like to participate in sketch challenges from time to time when im feeling inspired,1
i drove back to the beach staring at the thing on the seat beside me feeling very depressed,0
i cant do either of these things so i end up trying my hardest to suppress these feelings which makes me irritable and is very tiring,3
i get to pursue things that spark my curiosity and make me feel useful,1
im looking good and feeling good other than this crappy cold im dealing with,1
ive left my job i feel a lot less stressed in general and i had a really good time just observing how much the kids enjoy the process of creating something new,0
i hope i am not like that and i feel inspired by the prestige of others,1
i feel quite rebellious actually,3
i feel strange out of sorts and i wont resort to this again,4
i dont hate you i just honestly feel so bitter towards you atm,3
i sat there feeling so amazed that i actually found great joy in such simple things,5
i viewed all that stuff at the bottom and deciding i was going to come back when i am feeling bitchy just so i could list that as my mood i felt like an ice cream sandwich,3
i read the book and feel like i am travelling those journeys sometimes i am amazed sometimes i cry sometimes i laugh sometimes i yearn for what is written sometimes i remember my friends my family and the deceased and realise there is so much to do for them,5
im tired feeling crappy hungry and still dealing with ridding my house of the smell of vomit,0
i have had some very emotional nights of crying feeling unsure and angry,4
i don t feel that my society has accepted me whole heartedly,2
i get upset that i try to rekindle some sort of feeling excitement remorse longing anything but like i said even this feeling becomes a temporary phase,2
i was feeling irritated and slightly upset after this conversation,3
i also feel that no one in the music school is really being very supportive of me on this,2
ive been feeling the desire for a romantic interest even with my circumstances i feel as though im emotionally ready for a special someone in my life,2
i got the feeling watching it that only from starting out by making hats for his school friends could one develop such a clever use of resources train tickets doc marten soles barbies and shattered mirrors to name a few,1
i feel so shitty right now i just arugh,0
i feel so abused and taken advantage of,0
im honest i had already began to feel that i liked kiss guy a lot and therefore couldnt use him like that,2
im feeling ugly lately,0
i could clearly feel my adomen muscles contract everytime i cough like some adomen exercise haha and im aching from it now sigh,0
i don t want to cry either because i know she ll think i feel tortured having to eat the black part of the rice,3
i feel like im giving them a story to tell to their friends and family which is funny because growing up i anticipated to be the one to travel and spontaneously meet an erratic person that swoons me with their life stories,5
im sad for the kids whose mother is obese depressed and feeling hopeless because of her health,0
ive always been very nervous to do something like that as i feel like i am not really that talented to enter something into an official contest,1
i feel skeptical about the sustainability of that,4
i ini i feel strange,5
i thought he was going to say no but he just put on what i call his smacked puppy face and that always makes me feel rotten,0
i told her that we cannot continue this way and when she is starting to feel frustrated she has to let me know in a calm way,3
i only tried for three and i can still feel the longing that came with wanting a child,2
i remember reading red seas under red skies and feeling a bit disappointed,0
i read a story that left me feeling confused frustrated and a little angry,4
i feel utterly exhausted and unable to function,0
i feel pride that i don t have to buy a roll of quarters from the bodega on the corner and this feeling is the only thing that keeps me from being irate that our laundry room is oddly devoid of coin changer machines,3
i came home from work today feeling satisfied that work went alright,1
i really would feel terrible if i didnt let certain people know,0
i feel shamed hes not here,0
i felt god telling me this is what makes me feel loved,2
im freaking out worried feeling rejected,0
i dont have the hatred for juice that i had last night at this time but im not feeling too fond of the veggie smell in my kitchen,2
i wish i could call off the wedding just so i can feel carefree again,1
i am already feeling anxious then how is going off my anti anxiety medicine going to help me,4
i don t feel that longing,2
i feel contented staying grounded and take it slow as i build up the little things that comes my way,1
im grateful for the cozy feeling of hot cocoa and flannel nighties,2
im not the only one that feels this discomfort and discontent in general as evidenced by matt from muse quoted here talking about their album if you look at those protests in france the size and level of protest doesnt really relate to what theyre protesting about,0
i say nothing then i my feelings are hurt i feel uncomfortable and direspected,0
i do feel alittle submissive it isnt the same,0
i realise that although i originally started this blog for a specific purpose it has really grown beyond that and i shouldnt feel pressured to writing about specific things,4
i work out i feel invigorated,1
i must confess im feeling a little overwhelmed,4
i really feel amp dont be so uptight when expectations of others are met,4
im feeling very blessed amp grateful that i live in the united states of america with the freedoms we enjoy amp the opportunity to vote tomorrow for our next president,2
i feel like he counted my letter as one supporting the current status quo which to say the least is not what i stated,1
i feel traumatised and pained,0
stranded in the north of fraser island with a submerged wd hire vehicle,4
i get the feeling youve been punished enough,0
i will feel so glad to go sing me to sleep sing me to sleep i dont want to wake up on my own anymore,1
i mean already as a parent from the moment the iolani left my body i can tell you i feel like im constantly fearful for something horrible happening to her thats out of my control,4
i know we often feel like we dont know what books to use during our lessons and sometimes find the provided leveled readers to be boring,0
i feel that the music is kinda boring,0
i always had a feeling of being in shape and became increasingly frustrated with the daily accumulation of body fat elusive,3
i think i was feeling so excited today,1
i so much appreciate all of my readers and followers but please feel free to skip this pity party post,1
im feeling quite excited because i get to introduce you to my newest fabulous sponsor,1
i have to get on my bike days straight so feeling tender a day after playing rugby is good prep for that,2
i also loved the feeling of that gentle rippling through the body when i floated in water it was a bonus having friends with pools growing up in australia,2
i feel like a woman should be respected at all times therefore i made the right decision he said,1
i would be feeling miserable today,0
i have a sense of both in my mind s eye i feel that divine energy way up aloft and i experience its reflection in me sometimes like a rare sunny day in a rainy climate,1
i loved how all his pack mates bonded with her the touchy feely way they were with each other was sweet,1
i feel spiteful for typing this but the first hand knowledge and statistics ive gone over regarding mormons and anti depressants is startling,3
i didn t feel well,1
i feel with the capacity of a producer and an actor someone like david would be far more accepted when he comes onscreen and shows boxing in a different light,1
i feel so empty and cold inside,0
i feel oddly peaceful,1
ive been feeling really caring towards jt,2
i feel depressed to the point of developing high fever at least once a week,0
i feel more content with what i have achieved and i know if i don t write today there ll still be a tomorrow,1
i had been feeling extremely troubled and still am so the note was welcome as roy has a philosophy of life that is very salutary and calming,0
i know you cant just ged rid of your feelings but seriously i dont see your parents supporting you dating a guy who s their age,1
im feeling listless i like to go back to this music and remember the time i fell in love with it,0
i had a dream in which i was infuriated with my husband and so i woke up feeling infuriated with him but unfortunately a i couldnt remember the substance of the dream so i couldnt adequately express myself and b it was just a stupid dream,3
i feel so honored and grateful to have met kassim selamat of the swallows during my trip,1
i think his uniform and glove make him feel very important too,1
i feel that i have to justify this behavior to you my faithful blog reader,1
i feel really inadequate and i just wish i had enough brains to atleast pretend to know what i was doing,0
i feel like i was lucky like a four leaf clover,1
i feel always a tad bit more troubled at the conclusion with the days due to the fact i really often desire to hit my personal sales aim at the office,0
i learned to feel the clay and its limits the artistic expression became more important than the mastery of the material,1
i get to tell her that i love her to make her feel valued and appreciated to tell her how beautiful and intelligent she is i do,1
i just know i feel like i m on potentially shaky ground,4
i stayed under the freezing stream maybe a few minutes longer than i would have otherwise enjoying the feeling of water over my abused body,0
i feel as though at least in the range of age being doubtful or not believing in religion is not so uncommon while my mother who was born in sees being an atheist means you cannot be a moral person,4
i woke up later in the morning it was clear that she was feeling pretty lousy and luckily our normal vet had an appointment available later that morning,0
im watching a movie called sharknado i feel like my intelligence is being insulted,3
i am a bit of a romantic so i really feel like we missed out on those things this time but i would not trade the family time we spent together,0
i feel really lethargic today and just cant be bothered with much,0
i was feeling very vulnerable and down no one really close to me has ever died before i either hadnt known them very well or was too young to remember,4
i feel hopeless i cannot cope,0
i get changed i am feeling insecure,4
im not joking we had the feeling they were either extremely friendly or they hadnt seen a westerner before,1
i ached so bad the bones in my toes hurt to walk and i swear i could feel my liver aching,0
i had promised her i will buy their cupcake bt im feeling shy to face her n thn miss it,4
i hate being so hungry and weak that i feel stubborn and dont want to do anything productive,3
i feel like i know i m troubled and that s why i give myself an excuse,0
i look back on that i feel amazed that at such a young age i could just pull it together like that,5
i feel is only acceptable when that violence could lessen much more violence this could also apply to what i am discussing below i,1
i have written but you feel the need to point out that someone somewhere could be offended if they were to read my words out of context knowing nothing about me and after having a really bad day do not bother to inform me of this,3
i am also aware that there is no glamour in them and sometimes i just want to feel glamourous you know,1
i sit here feeling annoyed at my sons my pets and my husband im also trying to think of something to feel grateful for this saturday,3
i was feeling playful so i danced around the place,1
i can say that once again after the test drive we left feeling impressed by the cx and with steve and adams assistance,5
i feel a discontent an almost constant pull to travel need for an adventure to find my purpose and loneliness,0
im not feeling too keen on that,1
i don t feel particularly inspired,1
i feel even more pressured to cook healthy meals and not eat out do thorough preschool lessons with my boys keep the house spotless exercise serve the church and community and be a happy loving wife at all times,4
i get to know about it the more guilty i feel for not being as faithful as these guys are,2
i wont be totally satisfied until i feel like me and my work actually means something to more than my loyal reading viewing audience,2
i feel that popular bloggers dont post with freedom anymore there will always be part control rare exception is the blog love aesthetics,1
i didnt want to be lazy or feel groggy so i just kept drinking red bull,0
im simply feeling just a little unhappy about the whole skinnyg and even the charming customer provider hasnt made that go away,0
i feel honored that my art is going to fill a room where sick children need all the joy they can get,1
im feeling scared im going to treat this as sacred something valuable to venerate and pretend im like a cat,4
i feel eager and anxious and antsy in regards to it,1
i thought id talk today about getting cold feet im sure every bride will know that feeling when hubby to be did something that reeeeeeeeally pissed us off and we start yelling that we just cant do this anymore i cant marry someone like you,3
i feel like there isnt any dirty oil left on my skin after using this to clog my pores or make my skin oily towards the end of the day,0
i wouldn t make too big of a deal out of the situation you found your daughter in unless you feel prompted to not fearful,4
i get frustrated when i know that some of the things i am thinking or feeling are very very petty so i try and limit myself to opinions that have some sort of validity,3
i look into the news especially at these unsettling times sometimes i just feel so burdened to pray and cry out to god for the nations,0
i feel like all women are witches in someway why do we have to be tortured for being beautiful and powerful,3
i really feel rotten and my ear hurts so bad but i still managed to work out days and really push the intensity,0
i feel very delighted for my stay here in manila is nearing its end and feel so down for the same reason,1
i feel strongly that what you identify as the priority must be respected and explored in counselling,1
i feel if i say anything it just makes me look petty,3
i can feel the amused smile that tugs at my lips,1
i feel so uptight and tense,4
i feel that this community s most beloved living our lives gold or silver nest as their grass nest long time ago our house is divided now called the commercial housing,2
i get so irritated with the fact that i am a feeling emotional person but can t cope with feelings of rejection,0
i was constantly complaining of not feeling so hot,2
i feel like my casual nonchalant attitude is easi,1
i can t justify i get a little annoyed when non diabetics say they have low blood sugar because i imagine their low blood sugars don t feel as terrible as mine do,0
i didn t mean to sound as though i feel offended i meant it as a joke guess people didn t get it haha,3
i remember the same giddy feeling of contented good fortune lucky lucky me here safe in our cozy home watching my fabulous man head off for the day knowing he ll be coming home to me in a few hours,1
i feel pathetic and i want to push myself but the idea of chicken mince wheat free pasta rice spelt bread and fruit sorbet is quite scary,0
i said feeling strange uttering those words but space flight was still a pretty novel way of traveling in my time,4
i was in a really good mood at work and was feeling playful,1
i mean as a group thing it felt good to get in there and add something relevant for us but im still not really feeling delicious as a tool for me,1
i was going crazy thank god i have a craving for fruits and chocolate it made me go out in the cold with a gross wind blowing in my neck feeling mad and angry and crappy,3
i feel so weird and scattered with all wonders about a million different things,4
i feel like theyre perfect if youre too lazy to fix your hair,1
i didnt feel that it was strong enough to stop me from turning into a strawberry by the end of my holiday,1
i guess were annoyed agiatated and my sis feels hated darn cos i told her shes a geek i love you amy,3
i think writing like this will be more fun and fulfilling and i think that when i do decide to introduce b to my blog it will feel positive and overall more balanced,1
i feel like i am one of the most confident people around but maybe my confidence in certain things is not the same confidence i have in myself as a human being,1
i may pour out the half empty cup here i will still be making significantly less than i was making at the age of fresh out of college is an entire dollar and some change more an hour which feels like sweet desperate progress,1
im not feeling pissed off about picking up those toys,3
i definitely felt scared which made me feel vulnerable and i hated that,4
i feel heartless in saying so though,3
i mane is feeling generous and releases his new lp diary of a trap god for free,1
i must not feel complacent,1
i am feeling very generous this month so i have decided to give away free my kit a href http dezinesamaze,1
i personally don t think a cavalier should be trimmed i feel it spoils the look of this breed especially when it has such a gorgeous full coat,1
i feel like i am i the only one out there who is as angry as i am about suffering such loss about stupid cancer about unfairness about what is even though nothing about it is right,3
i came home still feeling stunned and in need of rest i received a call from a dear elderly cousin marie to say she called an ambulance for herself and would be going to the hospital,5
i feel they think im always glad but theres something they dont no im the one whos feeling sad,1
i feel that the tips given are very useful especially to parents with young kids like me,1
i reached the halfway point of the climb and my arms were feeling good but god dam my right leg was tired,1
i feel so blank and then like im going to explode,0
im feeling particularly benevolent today,1
i attempt to convince others of what they should think and how they truly feel i become a title resentful href http en,3
im feeling really adventurous maybe white,1
i feel i can step into the world of men with a dignified stance,1
i dont like chiharu see episode i feel that see is ungrateful and blind,0
i only cry when i think how guilty youll make me feel and yes ive fucked up a million reasons for shame and im sorry,3
i was feeling particularly beaten up by istanbul and homesickish i passed a burger king and the door opened and the smell hit me full in the face and suddenly i was in snowpea my white nissan stanza in the drive thru of the burger king on rt,0
i always have been when im not feeling sociable extreme or the other,1
i got an overall dark and uncomfortable feeling as we chose to stay until the end as not to disrupt or be rude,3
i feel honoured to be friends with you,1
i feel for the guy because i think he is sincere honest and intelligent,1
i feel utterly devastated that she must go through this and do so alone,0
i feel each time one of my posts gets massively downvoted pagetitle rugmi popular images of the now,1
i overcome the claustrophobic feeling that i get after i dont know but what i do know is that there is a path i need to follow to get to my vision and i need to make sure the road i choose has to lead there,1
i would like to know why duke university administrators feel that it is acceptable to readmit collin finnerty news story jan,1
i look back and i feel so incredibly satisfied with my life refreshed ready for my next adventure,1
i can see or feel about it is the divine possibility of being with you away alone for one long golden day at last anywhere,1
i feel really irritable when im surrounded with it,3
i love that its adoption of a teenager which many people feel afraid to consider,4
i always feel pressured to make it perfect fit for for all audiences and gorgeous in creativity,4
i feel helpless,4
i really have nothing to talk about i m just feeling so damn antsy and needy and lonely,0
i feel that sometimes my lessons are too boring to post here buuuuuut i have a dear friend rach who is a new sunday school teacher and wanting to see what ive been doing so ill still post my lessons up here,0
im feeling as if im not caring and i dont want to fail my finals,2
i feel you are so delicate now,2
i know i probably shouldnt write with that sort of angry passion here on the blog but i never want to feel inhibited on what i can and cannot post,4
i feel like i am the only one trying to accomplish everything especially the balance in our extremely distressed world,4
i started to feel discouraged,0
i think of the future of the subcontinent i find myself feeling optimistic despite everything i read in the papers,1
i feel really free i feel that i can grow wings amp fly,1
i start to feel happy and then i think of how lonely my cat feels,1
i feel scared to use headphones,4
i feel so useless in this,0
i am feeling that it my be a more dangerous task than dancing in a lightening storm with an umbrella,3
i feel rather petty that i just dont have time to have someone talented like christine make it,3
i feel foolish and desperate almost for feeling so strongly about this,0
i feel more irritated than peaceful,3
i feel troubled lord and i honestly don t know why,0
i can peruse a few pages before i feel that dull headache building at the base of my skull and by that point i m kicking myself for bringing on a dreaded case of car sickness,0
i do feel very successful right now,1
i can only feel sorry for us that the relationship didnt work out,0
i want to express my feeling i dont know how to start it but seriously i feel so miserable right now love or friend,0
i feel distraught worried panicked sick scared sad,4
id begun to feel empty and this was after having had several juices and lots of water water will only make you feel full for so long but it was quite good at rinsing out from my pie hole the putrid flavors id forced upon myself,0
i do feel very angered though,3
i feel the need to lend my hand in the loyal promotion of greg weismans baby in hopes that disney will some day pick it back up or at the very least sell the rest of the series on dvd,2
i watch movies set in the s and s i feel pangs of melancholy,0
i feel like i am going to throw up or something i hated that site soooo much,0
i woke on saturday feeling a little brighter and was very keen to get outdoors after spending all day friday wallowing in self pity,1
