Text,Value
i really remember is feeling wonderful in the oatmeal bath,1
i got separated from the man i loved,0
i feel todays schedule was an aching am to pm backed up by a mere hours of sleep one sandwich and tall espresso,0
i could feel the delicate pressure of her fingers searching to feel my arm beneath the course fabric,2
ive clawed time back and i still feel strong,1
i didn t walk the whole distance just sampled four or five stretches but i came home feel charmed by the experience,1
i love feeling brave,1
i wake up in the morning and have my voice and my throat feels ok but by the afternoon its all scratchy again and i sound like marge simpson until the night when its so bad and my throat is so sore i just have to whisper,1
im going to sleep now while i still feel triumphant,1
i have one of the guest rooms in our current house that was supposed to be my craft office closet but i honestly never use it since it is up stairs in a cold or hot room that i feel i can t get messy,0
i also have a niggling feeling that im getting complacent in my abilities,1
i feel at ease after sweet communing teach me it is far too little i know and do,2
i feel combination slightly superior sitting in on virtual event you ll feel as if it s another day office,1
i remember feeling the most terrified i had ever felt in my entire life and that its still affecting me now but ive never thought it accounted to trauma,4
i put up my christmas tree and im feeling fairly festive,1
i feel numb the way a wound does before it really starts to hurt,0
i didnt want others negative energy weighing us down and influencing my feelings and thought process during this special time,1
i feel glad and proud myself i could answer some complicated questions that i can t ever been done before,1
im just feeling very uncertain and,4
i tell people it feels like i am trying to convince people i am innocent but no one believes me,1
i feel very very burdened by so many situations around me right now,0
im not sure i relish the feeling of squelching mud between my toes when its contents are uncertain,4
i do not always find myself feeling thankful but over the years i ve gathered a few tricks that allow me to feel grateful in the face of moments when the last thing i want to do is say thanks,1
im constantly feeling alone,0
im taking advantage of feeling artistic incase it runs away again bell had her baby the other day yay,1
i still feel ashamed that i live in a world of people who dont know how,0
i don t want you to feel pressured into making love,4
i feel like im actually supporting myself by making use of what i know and love,1
i ask her what shed like to do and she just says she doesnt mind so i am always making suggestions and just feel like im having to try every day to keep her entertained,1
i like feeling suspicious and paranoid about everyone around me including my cat spending way too much time on self loathing thoughts sinking into unwarranted and unnecessary depression and then feeling supremely guilty for acting like such a bitch,4
i honestly believe those darker days are the reason i push so hard to be someone of worth in my future i feel it is my duty to make up for all the time i lost,0
i still want to be a lady who likes ladies who does not feel inhibited to kiss another woman in public but i guess i will just have to disregard societal views that pertain to my sexual preferences and how i portray them,0
i done something that i didn t feel inspired or challenged by,1
i feel that everyone has the ability to be artistic in his or her own special way and find that the most attractive art is unleashed fromthe virgin artists,1
i think the energy in our jobs and in our writing should not always be spent on what we think will sell but rather on our pet projects we truly feel invigorated about,1
im even starting to feel more sociable,1
i actually feel quite scared to get back to exercising because i feel like ive lost so much strength and condition and put on so much weight,4
i find it hard to feel jolly when throngs of people around me are so lost in the fervor of getting stuff that they cant see their heart for the green in their wallet encouraged by the constant barrage and pressure from every angle to shop here and buy more,1
i think he feels pretty cute in this,1
i wanted to go and ask him about my batting but was feeling hesitant about approaching such a big player,4
i got a bit caught up in the moment and forgot that at the core of the rude comments and silly songs were the real feelings of a beloved and brilliant comic actor and a very sweet and big hearted young woman,1
ive been feeling a bit overwhelmed with the whole marathon idea lately,4
i know i would feel weird about that and probably act strangely for a few days,5
i feel like an impostor in my work as i smile and talk about behavior contracts positive reinforcement cognitive reframing physical activity and other means for diminishing dissolving or deferring the pain of reality,1
i feel suspicious if there is no one outside like the rapture has happened or something,4
i feel so deeply shocked and saddened,5
i did manage two short runs and a walk but today im back to feeling just shy of awful,4
im told by horsey people that they are a rare find so i feel quite lucky,1
i have not spent that much time with them but i just don t feel that comfortable there,1
i think i brag and it feels strange because i still see myself as a little fattie pre teen unworthy of any male attention,5
i cant help but feel a little humiliated,0
i don t feel depressed for lack of a husband all the time,0
i feel really lucky to be part of what looks like an active and friendly homeschooling group here in dubai,1
i kicked you in the throat and now i feel terrific,1
im feeling much more positive about the impending move,1
i want her to still feel appreciative of things i do for her,1
i am feeling mellow excited about it partly because i know annie will churn all kinds of emotions inside of me esp,1
i want her to be able to trust me with everything i want her to feel like she is the most valuable thing on the face of the earth i want her to feel like there is nothing that i could ever even consider thinking about because of how amazing she is,1
im glad i have a god with whom i can feel safe,1
i doubles victory over brown struff we went back on sunday feeling really optimistic and looking forward to another day filled with more fedtastic tennis,1
i face turn red and feel shy emm no,4
i hoped to get from her this weekend in an attempt to not feel so utterly isolated inside ambleside with the curtains firmly closed on what was the warmest sunniest day of the year so far,0
i felt the sadness and remorse we are supposed to feel when we realize we have wronged someone corinthians,3
i really feel that we are progressing towards a society that is more fearless incrementally throwing away seemingly rigid boundaries like paranoia over security of one s belongings a href http www,1
i feel so unimportant insignificant like im slipping through the gaps between his fingers and he doesnt care,0
i am feeling a tad smug right now,1
i think browsers are more comfortable in my booth if all my attention is not focused on them and they don t feel pressured to make a purchase,4
i did develop unknown feelings for him i think thats the reason why i feel like ive been settling for all the other guys who liked me,2
i wasnt feeling that hot prior to vineman but with a little racin and a lot of self talk im now in a better spot mentally and physically,2
i visit m ller in my country and go to the expensive make up stands the sales assistants are always standing right next to me and looking at me like im going to steal something so i feel really uncomfortable shopping there,4
i was eager to know why i was feeling unhappy and unsatisfied,0
i feel crappy actually,0
i feel so invigorated so focused about what im being led to pursue right now and in the future,1
i feel i am shy and i am afraid of keeping my point of view,4
i feel like i get a lot of questions in my list of search phrases that point people here and sometimes i m awfully disturbed at the things that somehow bring my blog up in a search engine,0
i couldn t help but feel sympathetic for netflix as an army of the misinformed denounced netflix for the recent price hike,2
im not going to lie i feel a little insulted,3
i feel peaceful and unafraid certain that my god has my best interests at heart,1
i feel awful and have had chills on and off day and night,0
i was feeling at the start didnt want to move much at all was really glad to experience this glimpse into the sort of vibrant energy i will gain through out the year,1
i feel virtuous for going to spin class then driving all the way to blackburn in the manual unsupervised and sucessfully handbrake starting,1
i feel like nothing can stop me and sometimes i feel like so defeated,0
i email authors about interviews i feel a little intimidated,4
i believe people who use fulsome manners only for social reasons they aren t on the top of the scale of human evolution and i feel hurt by their fake behavior,0
im not necessarily sure what but something in the education system must change or students can feel anxiety and pressure with needing to be flawless with their vast knowledge of the world,1
i dont think my desire level is too much to bear but i feel unwelcome,0
i am feeling a lil bit gloomy,0
i find that i never stop feeling excited for our company s future,1
i am grateful for every single thing i have maybe then ill start feeling dismayed when i don t have more,0
i feel so stupid to think they will trust me,0
i feel awful everytime ac,0
i like the feeling of making some difference this time i was really reluctant to change at first however get used to it after a while,4
i feel like life was so flawless for so very long and now i am stressed out and wanting to cry half the time,1
i feel shafted or greedy,3
i stop feeling so depressed and,0
i feel so emotional reaching three finals in four years,0
i wasnt feeling well yesterday and today has been randomly busy,1
i the ultimate place to restore the peace to feel divine to kneel for worship and to attain hapiness,1
im feeling really positive desp,1
i feel when i read your words and realize one more time just how very good of a writer you are the feeling of shared sympathies,1
i feel pity for gatsby because the longing he feels for the past is so evident,2
i met you i used to want to lock myself into a vault just to feel precious,1
i really hate that feeling when youre unsure about something,4
i feel like those rich people all fall into the category of don t belong when i see them on the bus,1
i write which is what i consider my real profession even though by teaching poetry to troubled and poor kids i feel i m doing something useful,1
i feel honored to be witness to another s process,1
i had a horrible tragedy something that i was terribly ashamed of or something that was causing me great pain or that was making me feel vulnerable i have more than just one or two very trusted people who i know i could call for help,4
i feel stupid and incapable and i dont know what i want to do and work is stupid and only for the next two weeks and i m questioning everything,0
i am writing this at a time when i have also had an upset with the only real parent i have had almost constantly in my life and when theres no brothers and sisters around either i am an only child it feels kinda lonely,0
i feel like this concert was much more successful than the previous one,1
i was just feeling needy,0
i also feel so awful feeling this way,0
i always intended on achieving just so i could be with everyone else and feel like i was an intelligent productive and successful person,1
i feel like i have been beaten hard with a baseball bat under my arm which the doctor said was a very apt description,0
i feel overwhelmingly remorseful and guilty when i watch too much news or too many sad movies or television dramas,0
i feel completely drained physically and mentally worn out,0
i feel wonderful im tipping over backwards im so ambitious im looking back im running a race and youre the books i read so feel my fingers as they touch you arms im spinning around and i feel alright the book i read was in your eyes,1
im feeling so broke right now but i loved every minute of it,0
i want to say that i feel vulnerable writing and sharing this info,4
i was using it to vent out ugly feelings and be vicious and nasty rather then deal with them like an adult,3
i always thought that if i contracted something from one of those people and passed it on to him that i d feel awful but after i got the sti test i thought i was basically in the clear,0
i didnt feel that there were enough strong smart and funny female main characters in fiction and since thats what i imagine myself to be i started writing,1
i would just go to the straight point rather than doing a defination of such as what is romance feeling or anger feeling or suspicious feelings,4
i wasnt feeling casual much,1
i feel slightly emotional watching it,0
i feel like i ve regained another vital part of my life which is living,1
i went up to the teacher and said im gonna step outside for a second im really not feeling too well,1
i pray that each of you who is hurting or feeling afraid tonight finds peace and soon,4
i could feel myself getting that shaky feeling,4
i feel more crucified heartbroken tortured and forsaken than i have ever before felt but not at the hands of my enemy at the hands of those i love,0
i feel like he was more important to me than i thought he was,1
i believe its possible to be joyful and full of thanks while feeling overwhelmed and exhausted by life,5
i want people to feel brave and i want society to accept us as disabled people amongst us who deserve dignity and respect not to be shunned and laughed at,1
im feeling awfully spiteful right now,3
i feel more of a sense of longing than of loss,2
i guess you cant see how wed feel a bit unwelcome,0
i stay up and feel foolish,0
i think people born in the s and s hold the key to opening many doors for us we just need to make them feel treasured enough to share it,2
i would like to reduce the amount of jealousy i feel god commands us not to be jealous and i feel that every jew religious or not should obey that prohibition,3
i feel so highly intimidated that i get flustered and cant form my words not even in english with her,4
i feel reluctant talking about myself and my current situation to you as i don t know how you ll feel but i guess its important you know all about me and the situation i am in so that we ll know if we can go further,4
i learned in the foundry of my own childhood that humor made a perfect shield for keeping people at bay for helping me conceal my true feelings for lending the appearance of truth to all the lies i would tell about how happy i was and for providing me with the wherewithal to get through each day,1
id never do but i woke feeling stressed,0
i feel i need to put my beloved uggs to one side and get back on the ballet pump bandwagon,2
i feel terrible about the lady driver though,0
i had a pretty trying adolescence and any time im put into a situation where im made to feel inadequate it makes me revert right back into the shy awkward teenager with low self esteem that i was in high school,0
i am being told i should feel satisfied because i am in good standing with the powers that be,1
i actually just feel really eager,1
im sitting here in the belmont library listening to hold on tight by electric light orchestra feeling a bit of discontent,0
i feel really bless to have a very supportive family who appreciate everything that i do,2
i feel so welcomed,1
i shut the door but i didn t feel triumphant,1
i was feeling pretty wiped out mentally amp physically i was determined to get some oxygen to my brain,1
i said in some recent interviews we will have two guests on the next alcest album and today i feel glad to reveal the first one,1
my roommate was rude to me,3
i feel so weird not saying goodnight to mike,5
i feel lighter and more compassionate after i have these little talks with myself,2
i was impressed with how dunham portrayed hannahs whole experience from trying to deny that its happening to feeling offended when you feel like someone is trying to minimise the distress its causing you,3
i watched his face contort in sadness i began to feel regretful of my actions,0
i have been stumbling into quote after quote urging me because i really do feel they are meant for me to do away with my hated day job and dedicate my efforts to what matters most,0
i prayed to trust god with my desire to feel a divine sense of home,1
i found is that feeling worthless is a waste of time,0
i feel totally carefree with them around,1
i will not go into details from that long night but i woke up for our am bus feeling like i could barely stand and not trusting the pit in my stomach,1
i feel so incredibly graceful and sexy in this pose i have to say,1
i feel unimportant but even if i am in some way its still not my place to be making any decisions or voicing my opinions and its certainly not my place to be sharing my feelings,0
i am learning to step back and call it out to not be too proud to admit that yes i am feeling annoyed and yes i should tell you why,3
i want to avoid feeling disliked,0
i feel pretty lame typing that but my upper body is so weak,0
i feel very needy,0
i feel and i think that should be respected,1
i was feeling a little like a cold was coming on,3
i just wanna say that the last three months i feel so happy about my blog,1
i left feeling defeated like nothing had been accomplished the day a complete waste of time amp energy,0
i had ritz crackers in my desk drawer because theyre something ill eat even when i feel crappy and or dont feel like eating,0
i feel that tenure protects a lot of teachers that r innocent,1
i always feel i always understand that the people who are being the most hateful and harmful towards me are hurting themselves and taught wrongly and i hurt for them because i want to go back and undo the pain and childhood bigotry that binds their lives into this path,3
i did wake up this morning feeling more like myself so after days of sloth i was keen to get geared up and head to higher altitudes,1
i feel like the character precious,1
i feel in love with the weight watchers program and was faithful to count my points,2
i feel like one of those girls in school that i hated because their outfits were perfect everyday because they went shopping once a week,0
i fought i could feel myself trusting this man who was so patient and had a cool confidence more and more,1
i feel like my very essence is no more and work has drained my soul hopefully soon i will find my escape from work into a better path as i seem to be stuck only the cliquey get to move on and i do not want to roll like that,0
i feel surprised because i didnt expect it,5
i feel tortured by something,3
i feel suffocated yet charmed my brain pauses logic,1
i was feeling groggy and super tired during most of the fall we ended up staying home for thanksgiving instead of making the hour trip to see jimmys family,0
i had coped for barely twenty four hours before i was feeling wrung out and distraught,4
i feel that the father wants to tell you that he is pleased with you,1
i uploaded and put the link to in my previous post is only good for six more days or until i feel gracious enough to upload it again,1
im pretty sure it had to do with the fact that im dealing with hyperemesis not enough sleep and feeling irritable,3
i wanted to feel assured,1
i feel like copying the handsome boy say yay so fun,1
i am sorry that you feel i deserve to be blamed for the friends i pick all of which are better then some of the friends i could be hanging out with getting high and drunk while underage,0
i feel that it is dangerous to portray angels as walking the earth and intermarrying with humans,3
i am feeling a bit nostalgic so decided to take a tour through my memory lane,2
i feel excited about something that is soley for me here is the video about it,1
i feel like i m a doomed gladiator in a stadium constructed of cardboard and copies of romeo and juliet and the outsiders are screaming for my blood,0
i think she just rolled out i guess she s over it already i m kinda feeling that but no one has performed yet and word on the street is there is supposed to be a surprised performance by lil wayne nikki minaj and drake that would be dope,5
i feel a tender compassion glancing at her huge and heavy rucksack,2
i feel romantic and passionate toward my partner,2
i hated the day job and after a few months of feeling like i was being cosmically punished for doing a good deed i was getting ready to quit when i met the woman that would become my wife,0
i feel ashamed that i again let it come that far,0
i feel a little ashamed that i had such low expectations in the first place,0
i started feeling very gentle contractions about minutes apart,2
i feel like im being a terrible person and that hes going to hate me for thinking these things,0
i feel like a post might be devoted to dealing with emotions caused by situations vs,2
i flung into my suitcase at the last minute didn t break on the crossing over or explode in the pressurized cabin so thus far i m feeling pretty splendid about things,1
i need to listen to a song where i can be angry and feel accepted at the same time,1
i find myself seeking and yearning for love and acceptance from people that can not provide it and then being disappointed when i am alone and feeling unloved and unworthy,0
i feel accepted and appreciated by my teammates and peers,2
i know that feeling for sure,1
i was left feeling bothered by it for a long time afterwards,3
i feel like hopeless helpless worthless scum,0
i feel so blessed to have both lisa and god as friends in this life,1
i stopped feeling bitter and sorry for myself and lost myself in the work my work started getting better or rather continued to get better,3
i am still feeling a little remorseful that we didnt just break down and buy it,0
i feel more and more stressed,3
i do not feel like i am intelligent enough to be a teacher,1
i feel naughty just being this girls friend,2
i would stay in charge thereby helping z to feel safe yet at the same time be nurturing and loving,1
i fully enjoy music when i feel afraid using headphones,4
i feel so cranky right now,3
i feel all festive sitting down with my address book and list christmas songs in the background and writing a personal message in each one congratulations on your exam results,1
ive had so much more energy no more slugging around feeling lethargic after massive takeaways and choccy binges and my skin started to clear up instantly,0
i feel pretty insecure about my current relationship,4
i enjoy hearing the faith stories of other believers sometimes these stories leave me feeling inadequate and guilty,0
i feel like ending my life like some song from damaged or something,0
i feel totally rejected,0
i say no i feel guilty begins by giving you the reasons for and benefits of being assertive without being aggressive,0
i feel more jaded,0
i feel a little strange chasing after them since im so disappointed in the brand as a whole,4
i didn t feel too hot from the swim,2
i was to her in fact so i m taking that as she feels regretful for what she has done,0
i feel embarrassed by it,0
i perceive you feel the dint of pity these are gracious drops,1
i always feel slightly worthless almost self condemning like i should be doing more amounting more saving the world one day at a time a preacher on a podium a counselor for teen single struggling mom s a writer a motivational speaker a super mom to my baby boy,0
i chose to live my life as a normal person who has feelings wants and desires i have talked up for myself been faithful to myself and i have been determined to be treated with dignity and respect,2
i feel this violence is petty and impractical,3
im feeling a bit more sociable now although i dont think ill be able to express everything i want to say,1
i try not to laugh because sometimes it hurts vellas feelings but some of the things he does are so funny,5
i love tall guys they make me feel so little and innocent however innocent was the last thing that i was that night,1
i feel strongly about or a line that i want to draw in the sand so to speak i shouldn t be afraid especially at this point to bring up how i feel about what my conclusion should entail etc,4
i feel civilly disturbed class delicious title share this on del,0
i still feel its a little shaky at times and can move into the slightly odd jades hair in particular seems prone to this but generally it works well with spencers writing,4
i feel is a dumb plot idea,0
im doing things that make me feel brave and strong i have a a href http derfwadmanor,1
i just feel cold and drained all the time im either hungry or tired or cold at the moment and it sort of sucks,3
i have to leave my hair alone now if im feeling impatient,3
i feel not surprised by where i ended up i m happy with a lot of what i ve achieved the positions i ve put myself in,5
i just love the colors and the way the yarns feel i also love supporting small businesses and it allows me to provide quality products in my own shop,1
i am not normally the kind of person who gets emotional upon meeting a public figure but as strange as it sounds seeing you yesterday for the first time ever the feeling came over me was the feeling one might feel upon seeing a beloved favorite loving aunt lol,2
i am reliving all of the feelings of being rejected less than and not good enough from years ago,0
i love a movie with a good feel to it that really keeps you enthralled and the road has just that,5
i was feeling quite casual that day,1
i should feel like successful independent woman a la destinys child no,1
