Text,Value
i know how it feels to suffer pain and sorrow and loneliness and to know that mom is suffering because of her illness,0
i can t get past is that feeling when a friend walks out of your life and you re unsure why that feeling of not being valued or important enough,4
i feel and im irritated by it,3
i have lately been feeling very productive with my time at home and happy with my life in general and happy with my children and my husband,1
i often feel like im drowning as i try to come up with valuable content and write engaging posts,1
i swamp uncaring unfeeling fucked up apathetic humanbeings who wont pull their heads out of their asses long enough to turn around and look at me and say i see you,3
i pollution flower dew moisturising gel cream delicate luxurious and feels lovely on the skin,2
i blush because i feel guilty about asking for something so costly for being worldly,0
i know in advance then i am fine with it but if i make plans and they change or fall through i end up not knowing what to do with myself and feeling very restless and angsty,4
i feel deer supporting mice parade at the hope rel bookmark permalink,1
i wasnt feeling when i got on board but its really not pleasant,1
i feel like a very useful engine mother those of you who have watched thomas will understand,1
i started to feel apprehensive about it,4
i was on to stop labor made me feel terrible,0
i am having really badly cannot wear anything without causing spasms diarrhea or eat more than a few of mouthfuls i am feeling very miserable,0
i am torn about the situation because it happens a lot but they have supported me and i feel like i should be supporting her again now,2
i have been so happy these past two months you give me so much that i feel ungrateful admitting i think i need more,0
when i learned that my former boyfriend had become engaged although i was glad that he had found what he wanted,0
i feel more grounded and less fearful,4
i would really like to be able to help out financially around the house and it makes me feel that much more useless when i cant,0
im feeling pretty smart,1
im feeling so pissed off now,3
ill admit to feeling a little paranoid and wondering about how many others had defriended me,4
i dont forget it i embrace it i dont feel pity i feel proud,1
i feel so helpless and only hope that somehow they are receiving their dose of drugs that will help them get threw these hard times,0
i hauled it i feel dumb i got my lock and key i paid a man his fee now i wait and see frank black amp the catholics devils workshop released simultaneously with black letter days i initially felt this was the better of the two,0
i feel like im selfish,3
im feeling very optimistic about it and find myself wanting to ride more and more,1
i feel totally confident that i could get a job at google,1
i wish things didn t feel so strange so out of place,4
i go to school feeling miserable but end up laughing for some reason is weird,0
i dont want to make a bad impression with my new co workers in both my job or my lab simply because i just feel so insecure and agitated all the time,4
i can t stop thinking about it i feel paranoid like they re judging me i know they re probably now but i just feel that way,4
i feel deeply disappointed,0
i was feeling irritated with the supposed guy who wasting my valuable time talking to a lady,3
i feel like it is almost vital that if i do not find more answers about a href http quilting,1
i want to not feel angry because i haven t the right to feel that way,3
i feel a bit shaken though,4
i feel more vulnerable and more in touch with my heart with making choices that are better for myself and my family and less worried about pleasing everyone else,4
i would feel better,1
i feel so overly blessed in this life,1
im looking through pictures and feeling the creative tingle in my blood that makes me feel like home,1
i feel like a snob but i ve been a bit skeptical of it from the start because i have no idea who kenny werner is and neither does thomas a musician who gave me the book,4
i guess which meant or so i assume no photos no words or no other way to convey what it really feels unless you feels it yourself or khi bi t au th m i bi t th ng ng i b au i rephrase it to a bit more gloomy context unless you are hurt yourself you will never have sympathy for the hurt ones,0
i feel like a proud new mom with all this picture taking of heidi,1
i havent felt like posting in such a long time but i feel more sociable now,1
i feel incredibly slacking mrs greedy guts is still in desperate search for an unspoilt base on her career ladder,3
i feel bad for a lot of these people because i know from watching documentaries that people who do these drugs are trying to fill a void something that hurt them in the past that they are trying to fill with this drug that makes them feel temporary happiness,0
i can feel it think i determined to a href http usarious,1
i feel remorseful about leaving food behind and make an effort to eat at least half of it but after stuffing myself at fruits parlor and eating this hamburger steak and all,0
i feel surprised when i looked new,5
i wanted other women to feel envious of my figure and say oooh youd never guess youd just had a baby,3
i woke up feeling ok but i had a weird feeling about the run today,1
im feeling anxious all im really trying to do is project the exact opposite,4
i feel the cold mostly in my arms and torso,3
i feel drained just looking at the date of my real last entry,0
i have a feeling i shall go mad,3
i have found a no of people raising this issue but then i have not yet come across any officials addressing the same i am just feeling helpless,4
i feel rather listless and dull today slightly head achy and good chances of blahness throughout the day,0
i feel so often when i roll through my beloved new york that so little is done for so many if i start to write about race colour religion and sexual preference and gender identity my readers will say hey mia what s up are you confused,2
i luckily i don t think anyone i know was there at the time but can t help feeling a bit shaken,4
i am feeling emotional about something or other positive or otherwise,0
i think beaches are my favorite places although i get the feeling i would be quite fond of the desert also,2
i mean i have a lot of love to give and i feel most myself when i am giving and loving,2
i feel petrified about his future,4
im in the car with my roommate and her family i feel like im being all rude because i have to call her and my dad so that my dad can give her directions and she keeps asking what she needs to bring,3
i will feel fantastic refreshed and rejuvenated as if i had just woken up from a restful hour nap,1
i fared pretty well and was feeling quite pleased with myself that the journey went well,1
i went crazy non stop dancing at rouge with her only because the live band was very good i was feeling very troubled and wanted to dance my problems away,0
i didnt like my former fob and felt joy when i received a telegram offering me a new one that i though better and for which i had been waiting,1
i remember a couple of years ago i was feeling romantic and dreamy and asked him wonder if we ll celebrate our th anniversary,2
i could feel tears welling in my eyes and felt disappointed at my lack of fitness and ability to keep up and my annoyance at letting it get to me,0
i had just bought some stuff in guardian for contests and was feeling a bit too over the top if i grabbed indiscriminately in caring as well,2
i dont want to put to much pressure on myself but i feel like i could make the most amazing year ever,5
i always flashback to her talking about feeling burdened appearing on a radio show alone on lee jaeryong jungeuns good morning,0
i feel annoyed by that girl,3
i feel about the scratches the way i feel about my wrinkles i am fond of them and regard them as evidence of a life well lived,2
i mean how can you not feel festive when youre wearing a great big snow man on your chest,1
i feel completely isolated in the world thinking that i m the only one like me,0
i was feeling relatively indecisive and not very hungry until we walked past a barbeque place,4
i have to care about and care for people with disabilities who are targeted by sensationalist media reports as well as at the same time feel the sorrow i do for the parents family members and community in newtown connecticut that is stunned by the events of today,5
i had a hard time feeling joyful this morning because this morning it was just about the gifts,1
i feel is a dull worry,0
im still feeling that christmas loving with my polyvore boards and its only the start of advent,2
i could quote you a recent poll showing of young american muslim men feel suicide bombings are acceptable in defense of islam so apparently things like dont kill are not universally shared moral values,1
i feel humiliated by the person who phoned,0
i put weight on it with my leg bent like when i get out of the car i feel a dull pain in my knee,0
im feeling pleased and glad that other people like thaliad and want to celebrate it,1
i would feel more environmentally friendly if i sold it,1
im feeling very hesitant about wanting to buy another house,4
i feel the eyes on me the hateful eyes on the other side of the glass that belong to the family members of my beautiful victims,3
i just feel like lex has convinced you that youre something that youre not martha said her eyes getting misty,1
i witness what i feel helpless to change i take up my arms my heart and my pen and i write,0
i feel when the super exciting sensory bombardment is over,1
i have really notcied is my mental clarity like im finally beginning to wake up after years of a foggy brain and feeling lethargic,0
im feeling wildly supportive as i swallow my tension that every single other five year old i know of not only knows his letters but knows them backward,2
i set out to make a copycat version of it saturday and i feel i was pretty successful,1
i sit here tonight i feel anxious,4
i feel im miserable when i try to do other things,0
i have to move stop staring at the other ladies this doesn t feel good does it feel bad,1
i feel idiotic sifting through personals sites only nerve,0
im starting to feel and think as if i dont want to continue to pray for him anymore because its making me feel hopeless,0
i have also been feeling completely overwhelmed and so incredibly unappreciated,5
i will be honest it did feel a little strange being in the company of such greatness,5
i suppose it s partly my fault for forgetting my earplugs but it s still really frustrating to feel like you re being permanently damaged for no apparent reason,0
i feel defeated extremely agitated as well as frustrated beyond words,0
i feel like i ve already read every clever profile seen every picture and more importantly gone out on a first date with every guy on okc eharmony match etc,1
i normally would call meaningless and stupid but i guess im feeling a little bit adventurous,1
i feel spiteful toward him,3
i can make someone feel unwelcome rrreeaallyy fast without saying a word,0
i was feeling discouraged and disgruntled and i was a href http tracifishbowl,0
i feel it is rude of me to ask,3
i just do it to keep up with ian but really i feel shitty about it and wish i could just date ian,0
i continue to feel nervous inside and long to talk sensibly even just one time around someone its so wrong to have these feelings for on so many levels i have no clue,4
im going to be honest with you i feel distraught,4
i feel this energy of the divine flame,1
i feel thrilled this will all be over in a matter of days,1
i feel disturbed because of the world i saw through the camera s eyes,0
i like to watch people do horrible things so i can be outraged at them and feel superior,1
i feel a little awkward about this but im going to share a poem with you,0
i feel hated by my parents,3
im feeling groggy and having a bad skin day,0
i feel your presence beloved,2
i never feel bad spending money on other people just when i spend it on myself,0
i would spend hours prepping for the meeting with my supervisor and feeling convinced that i ve nailed it,1
im sick of being dependent even partially so on someone that makes me feel so unwelcome,0
i still feel jealous of my friends when their moms talk politely with them,3
i shook it off as we walked into the expansive beijing capital international airport feeling utterly un amused at the prospect of an international transfer in china,1
i was terrified that the revelation of my feelings would drive him away though he reassured me it wouldn t,1
i don t know i just had this gut feeling and it just really bothered me he said,3
i feel glad for you,1
im in a place right now where i feel safe and peaceful,1
i feel is most dangerous is people dismissing these disconnects and not considering them trials equal to the physical hardships of the revered pioneers,3
i agree it looks gorgeous and feels amazing but i have only worn it out on the town one time on new years eve,1
i used to share my feeling and thought all to my lovely roomates shermin and joey,2
i surmise that after i have made myself sick one too many times on take out and sitcom re runs that i will come around again into feeling dissatisfied with a stationary life without much forward motion,3
i feel that the only acceptable solution is to replace this brush with its rightful mac predecessor,1
i just feel like its rude,3
i feel like my life has become rather dull it lacks excitement but i feel next year will be different,0
i bought into what the world had told me would fill this emptiness but all it did was leave me lonely feeling confused at the emotional baggage and physical consequences i never expected,4
i think im allowing myself to feel this way because im not heartbroken,0
i know whos interested in renaissance and baroque art i can relate with jamie because she like feels tender towards everything and thinks that inanimate objects have feelings,2
i wanted to write and feel purged of those repressed feelings,0
i got on and was nervous feeling very timid and shy but after a while we were talking like weve known each other our whole lives,4
i feel that if he hadnt appeared out of nowhere and distracted me i would have noticed the light change and none of this would have happened,3
ive realized over the last few months that i generally tend to feel tremendously dissatisfied after having sex with him,3
i feel rather pissed off,3
i am tied down to my thoughts in class as in life i cant perform i feel ashamed and afraid to be in myself,0
i was feeling ok it would be fun to drive over to dunstable and stand in a field for an hour or so watching people try and drive preposterous motors up grass slopes thats trialling,1
i mean its beginning marks the end to one of the best months of the year which im left feeling exhausted from,0
i feel so carefree i never think of the crap going on in my life,1
i feel that everyone is entitiled to their opinion and that opinion should be respected,1
i got contact lenses the other day and am trying to get used to them i feel like my face looks really weird without glasses and its so strange when i see myself from a distance,5
i feel like i am doomed to spend the rest of my life in customer service i,0
i still have that feeling to you until now ya the feeling to loving you,2
i find that i cant do as much as i used to do without feeling exhausted,0
i feel very optimistic about everything at this moment,1
i said im only pages and this book feels so tortured and you can really feel the pain of the characters,4
ive been feeling like i cant put a lot into this because hes not caring about it anyway,2
i was well and feeling a bit of cabin fever i unwisely convinced spooky to take me to a matin e screening of scott stewarts legion,1
i like to pray a decade whenever im feeling stressed or scared,3
i am just waking up with not nearly enough sleep and feeling dazed,5
im referring to a comment in the pattern right now not feeling that divine really since i probably was born with a set of dpns in my hands,1
i kept thinking about how awesome i would feel afterwards remembering how amazing i felt after my emotional spin class the previous night,5
i feel vicious and sleepy,3
i feel like an ass saying that since my sweet sister has gone through quite possibly the worst year of her life at the same time,1
i feel damaged from just witnessing it,0
i say that i feel like im hated,3
i am a happily married man shows me his wedding ring and i swear i am not hitting on you but i just feel this sweet energy from you like i know you but i dont know you right,1
i took a day off which is so unusual for me i almost feel naughty,2
i haven t done it in a couple years and now i feel like i m at a place where i hated it when i was doing it but i wish i could do it again,3
i hope that you are all feeling festive and keeping warm,1
i never want to be rude even when i feel someone has been rude to me and even then i don t want to i feel like i need to like if i don t crush the offender thoroughly i will be left in tears in front of everyone because i am so sensitive,3
i feel my repressed emotions surfacing im glad for the solace i can seek in my writing,0
i am feeling like i have more energy and loving every minute of it,2
i feel stupid about my diamond richie mix up,0
i love taylor swift because she has so many inspiring song and her song always represent what i feel and she is so damn gorgeous and she is very nice to her fans,1
i was pretty tired feeling a little homesick and not at all in the mood to mingle,0
im great at complaining because modern society is geared toward making people feel inadequate,0
i am still feeling pretty lousy from this allergy induced stupor so last night i just was not really feeling wildstar and interacting with other human beings,0
i feel even more bothered because here i am being bothered by this when the boy probably isn t even thinking about this,3
i hate being selfish but i gotta admit i feel so depressed about it,0
i can truly empathize with your feelings of failure and discontent i would challenge you to re focus that energy in order to gear up for the next cycle,0
i don t feel comfortable doing it is what i m trying to say,1
im which turned out to be easy yummy and made me feel very clever as i was able to make sandwiches and soup out of the leftovers like my mum,1
i had awesome workouts and feeling amazing,1
i wanted to feel like i could depend on you and put in ur care and dare i say tender hands some of the things i hold dear u like a winter never seen in these lands became so cold,2
i didn t even think i was the type of person that could feel homesick,0
i grabbed him by the collar and pulled him against me in a passionate tonguey kiss feeling his long member slide between my waiting ass cheeks as it pulsed on the frantic bud of my clit,4
i knew i have this feeling but i ignored it,0
i feel out of place posting here since i feel so hesitant to join aa full force but i could use some insight from the people on the inside,4
i feel isolated as a stay at home mum shonas story notes d athe only negative for me is that i feel isolated as a stay at home mum,0
i diabetes and clinical depression and put right the record on my abstinence from alcohol for over eight years i feel more calm and listened to by the specialists,1
i really feel cute when i wear them,1
i feel i am being neglectful to a lot of you by not responding to your comments,0
i am feeling pretty sad because it looks like i wont be able to plant my tomato garden this year,0
im sitting on the couch thinking about how miserable i feel from indulging in too much delicious food,1
i feel so idiotic for letting you and myself call us best friends,0
i feel much alarmed at the prospect of seeing general jackson president,4
i either feel like crap about myself all day and try to make up for it the rest of the day and am exhausted,0
i am feeling very thankful and relieved,1
i am feeling quite anxious about it all,4
i feel that he s really shy with his feelings because as he talked about how he felt what happened during the trip he was really nervous and i appreciate the effort to say all of that by the way,4
i feel slightly weepy about this milestone and a lot happy,0
i seem to remember feeling very contented,1
ive basically been cold calling companies with very little success which is why ive been feeling depressed from getting discouraged,0
i am so fucking sick its not funny my head feels like its going to explode my sinuses are aching my stomach is feeling sloshy im not sure if thats good,0
ive been resting and feeling generally unpleasant and queasy but in that frustrating background way where you dont feel right but cant place an exact cause,0
i am feeling jealous i remind myself of this story and it keeps me on the path to better living,3
i feel so honoured so have been allowed to write my story and,1
i achieved was deepening my realization that i need to plan ahead to feel satisfied and avoid making silly food choices,1
ive had my ass handed to me by murt and im starting to feel fucked but just a little,3
i feel extremely discontent right now,0
i realized i was a total idiot and forgot clarinet choir making me feel even more idiotic and stupid then i already was,0
ive been feeling homesick for several months probably since christmas,0
i stropped about for a bit feeling grumpy because i was missing out,3
i am never happy for the things i do have i feel so ungrateful for that,0
i wanna know how does it feel being pretty and every guys love me,1
i feel completely inadequate and unable to express any of it in words,0
i like your t shirt can achieve that and instill a sense of making the customer feel valued as a person but such comments should be sincere,1
i not seeing and feeling the divine,1
i feel fucking pathetic and desperate for your hello,0
i do buy synthetic pearls when i feel the need to and i use these for some of my more elegant jewelry and trinkets,1
ive been feeling restless inside and i dont understand why,4
i did feel unsure about it but thanks to l a lot of people liked it,4
i was feeling rather self satisfied that my teen daughter and i were facebook friends,1
im shocked i feel my own little problems put into perspective and i feel heartache for the innocent lives that have been ended,1
i feel so insecure about my writing,4
i also feel that i am often a burden and in the way more than anything as a nursing student to the other nurses yet i must remember that while some may be grumpy at our presence everyone has to learn somewhere and boo friggety hoo if some medical personnel are irritated by the nursing students,3
i feel a little bit brave,1
i often refer to myself as being weak im not sure what i mean exactly when i say it but i do know that when i reflect on the past two years i feel strong strong and accomplished,1
i still feel like i look messy and its no use to try to change it,0
i know he needs space to deal with things but i am left suddenly feeling even more helpless and alone,0
i am for the first time this year feeling the cold,3
i feel hopeless right,0
i feel as though i am living on an island as i put the delicious moisturiser on a sample which is lasting a very very long time used twice a day and the rest of the products are so gentle yet cleansing and moisturising,1
i feel more like the girl i was when i was at i was fearless excited for life and discovery,1
i have a feeling might have offended one of the dorks sitting in the censorship cubicle of doom,3
i can break myself out of having this dream as it leaves me feeling groggy and disoriented and i dont like it,0
i nodded proud of my decision to procure a pump feeling slightly smug,1
i feel ecstatic because no more homework,1
i wanted to really love this book social thought provoking personal histories are just my thing but i left feeling disappointed by this one,0
i went to registration passed an uneventful five minutes feeling deeply amused,1
i feel charmed to see my harder plan and adherence appear to accomplishment now and in august if we will attempt for an olympic medal,1
i feel a despairing sadness because after so much time working on this we have to cut ties,0
i have an overwhelming feeling of sadness that there are people in this world that are so hateful,3
i arrived at the gym she was such a ball of sunshine and made me feel very welcomed at the gym although i felt like a dorky unfit rotund sloth that did not fit in with the environment of buffed fit looking and fierce looking bloke,1
i feel too rushed,3
i can feel his impatient and i can t stop my body from giving him positive response,3
i have been having bad dreams really weird dreams that make me feel like i got no sleep at all and with completely disturbed thoughts,0
i feel pressured helpless because i dont have control over this,4
i woke up feeling dazed and confused,5
im done with putting up with this constant bullying because that is what it is when you feel threatened and constantly on the defensive and i am tired of constantly defending myself to others,4
i is an extremely positive feeling a divine energy who alone can take our quaking boat to the shore,1
ive been feeling all listless this two days,0
im feeling a little stressed,0
i feel cute because the tune of the song days of christmas played on my mind pia again almost my best friend because were going out like everyday and i can share to her almost everything and we understand together and i went out,1
i feel like i have suddenly lost a limb in a tragic accident,0
i think that when we say i feel so alone in this or i feel like i am facing this all alone we dont really mean what we say,0
i feel like im having something really naughty like dessert for breakfast,2
i feel shaken or angry that my husband keeps lying to me and is a sexaholic i often start to feel mad at god,4
